ilju_a,ilju_b,케미_점수,케미_타입,종합_분석,연애_스타일,주의_포인트,럭키_데이트,생성시각
甲子(갑자),戊辰(무진),88,성장형 갓생커플,곧게 뻗은 나무(甲)와 넓고 든든한 대지(戊)의 만남! 갑자님에게 무진님은 존재 자체로 안식처이자 기회의 땅이에요. 자수와 진토가 만나 촉촉한 습기를 머금으니 사랑이 무럭무럭 자라는 시너지 미쳤다! 서로의 꿈을 응원하며 함께 레벨업하는 갓생 메이트 각이에요.,든든한 지지 속에서 피어나는 텐션! 무진님이 듬직하게 리드하면 갑자님이 창의적인 아이디어로 분위기를 반전시켜요. 안정감과 설렘이 공존하는 클래식하면서도 세련된 연애 스타일입니다.,가끔은 고집 배틀 금지! 서로의 선 넘지 않는 리스펙만 더해진다면 세상 어디에도 없는 무적의 소울메이트가 될 수 있어요. 대화로 풀면 케미 폭발!,"식물원 카페, 등산, 갤러리 투어",2026-03-06 23:53:02
甲子(갑자),癸酉(계유),92,촉촉 힐링 케미,푸른 나무 갑자님과 맑은 이슬 계유님의 만남은 그야말로 시너지 미쳤다! 계유님이 뿜어내는 섬세한 에너지가 갑자님을 무한 성장시키는 텐션 세계관이에요. 서로가 서로에게 영감을 주는 소울메이트 각이라 같이 있을수록 멘탈이 정화되는 느낌을 받을 거예요.,"세상 힙하고 감성적인 바이브! 대화가 끊이지 않는 티키타카는 물론, 서로의 취향을 공유하며 전시회를 보러 가거나 감성 카페에서 인생샷 건져주는 찐사랑 스타일이에요.","둘 다 에너지가 섬세해서 가끔은 예민해질 수 있지만, 이건 서로를 너무 아끼는 마음 때문! 솔직한 감정 공유로 밀당 천재가 되어보세요. 표현할수록 케미 폭발!","LP 바, 비 오는 날 드라이브, 감성 전시회",2026-03-06 23:53:42
甲子(갑자),戊寅(무인),82,파워 성장형 케미,자유로운 나무 갑자님과 듬직한 산 무인님의 만남! 서로의 성장을 자극하는 에너지가 대박이에요. 무인님의 리더십에 갑자님의 유연함이 더해지면 못 할 게 없는 무적의 시너지 미쳤다! 서로를 존중하며 함께 정상으로 향하는 텐션 세계관입니다.,서로의 커리어를 응원하며 데이트하는 '갓생' 커플 바이브! 같이 있을 때 묘한 긴장감과 열정이 넘쳐서 권태기 틈이 없는 찐사랑 스타일이에요.,둘 다 에너지가 강해서 가끔은 주도권 밀당 천재가 될 수 있어요! 서로의 영역을 인정해 주는 쿨한 리스펙만 챙기면 더 견고해질 거예요.,"루프탑 바, 테니스 클래스, 서점 데이트",2026-03-06 23:54:27
甲子(갑자),癸未(계미),85,단짠 힐링 케미,푸른 나무 갑자님과 촉촉한 단비 계미님의 만남! 계미님이 갑자님의 뿌리를 섬세하게 챙겨주니 정서적 안정감 시너지 미쳤다! 서로 다른 온도차가 오히려 묘한 중독성을 부르는 텐션 세계관이에요. 함께 있으면 세상 무해한 댕냥이 커플 모먼트가 뿜뿜하는 소울메이트 각입니다.,포근하고 몽글몽글한 바이브! 화려한 곳보다는 우리만의 아지트에서 깊은 대화를 나누는 걸 선호해요. 은근한 밀당 천재들이라 지루할 틈 없는 찐사랑 스타일입니다.,가끔 서로의 속마음을 추측하기보다 쿨하게 공유해 보세요! 각자의 시간을 리스펙해 주는 '따로 또 같이' 스킬만 장착하면 더 완벽한 갓생 커플 등극!,"만화 카페, 심야 영화, 호캉스",2026-03-06 23:55:10
甲子(갑자),戊子(무자),80,운명적 거울 케미,똑같은 '자수' 에너지를 품은 두 사람! 서로를 보는 순간 '어? 나랑 좀 닮았는데?' 싶은 운명적 이끌림이 느껴지는 소울메이트 각이에요. 갑자님의 당당함과 무자님의 실속 있는 바이브가 만나면 현실과 이상을 다 잡는 시너지 미쳤다! 서로의 마음을 누구보다 잘 읽어내는 텐션 세계관입니다.,말하지 않아도 통하는 텔레파시 연애! 굳이 화려하게 꾸미지 않아도 함께 있을 때 가장 나다워지는 편안한 바이브예요. 소소한 일상을 공유하며 찐사랑을 확인하는 스타일입니다.,둘 다 생각이 많아질 땐 가끔 동굴로 들어갈 수 있어요. 그럴 땐 서운해하기보다 '혼자만의 충전 시간'을 쿨하게 리스펙해 주는 센스! 이것만 지키면 밀당 천재 등극!,"와인 바, 야간 드라이브, 홈시네마",2026-03-06 23:56:04
甲子(갑자),癸巳(계사),95,갓벽 상생 케미,"시원한 나무 갑자님과 영리한 이슬 계사님의 만남은 그야말로 시너지 미쳤다! 계사님이 갑자님에게 꼭 필요한 비타민 같은 에너지를 공급해주니 서로를 빛나게 하는 텐션 세계관이에요. 따뜻한 햇살 아래 나무가 쑥쑥 자라는 것처럼, 함께 있으면 인생의 정답을 찾아가는 소울메이트 각입니다.",지적이면서도 힙한 바이브! 같이 최신 팝업스토어를 돌거나 사회 이슈로 토론해도 티키타카가 폭발하는 스타일이에요. 서로의 센스에 반해버리는 찐사랑 데이트가 일상!,둘 다 머리가 너무 좋아서 가끔은 수싸움하는 밀당 천재 모드일 때가 있죠? 가끔은 계산기 두드리지 말고 직진 고백 한 번이면 케미 폭발 확정!,"팝업스토어 투어, 재즈바, 커스텀 클래스",2026-03-06 23:57:00
甲子(갑자),戊戌(무술),78,단단한 성장 커플,쭉 뻗은 나무 갑자님과 드넓은 황금빛 언덕 무술님의 만남! 갑자님이 무술님이라는 든든한 터전을 만나 뿌리를 내리는 텐션 세계관이에요. 서로 다른 성격이 오히려 서로의 빈틈을 꽉 채워주는 시너지 미쳤다! 함께 있으면 현실적인 목표까지 갓생으로 이뤄내는 소울메이트 각입니다.,안정감 100% 으른 연애 바이브! 무술님이 묵직하게 중심을 잡아주면 갑자님이 톡톡 튀는 아이디어로 활력을 불어넣어요. 신뢰를 바탕으로 한 찐사랑 스타일입니다.,둘 다 은근 자기 주관이 뚜렷한 밀당 천재들이라 고집 부릴 땐 귀여운 양보 한 번씩만! 유연하게 소통하면 애정 지수 무한대로 폭발할 거예요.,"궁궐 산책, 대형 카페 투어, LP 청음",2026-03-06 23:57:49
甲子(갑자),癸卯(계묘),94,수분 충전 케미,큰 나무 갑자님과 촉촉한 단비 계묘님의 만남은 그야말로 시너지 미쳤다! 계묘님이 뿜어내는 다정한 에너지가 갑자님을 무한 성장시키는 텐션 세계관이에요. 서로가 서로의 활력소가 되어주는 소울메이트 각이라 같이 있을수록 생기가 도는 갓생 커플 등극 확정입니다.,몽글몽글하고 귀여운 바이브! 계묘님의 섬세한 챙김에 갑자님이 든든한 버팀목이 되어주는 찐사랑 스타일이에요. 소소한 대화만으로도 도파민 터지는 티키타카가 특징입니다.,둘 다 에너지가 넘쳐서 가끔은 감정 과잉 주의! 서로의 선을 지켜주는 리스펙 한 스푼만 더하면 세상 어디에도 없는 밀당 천재 커플이 될 수 있어요.,"플라워 원데이 클래스, 식물원 산책, 인생네컷",2026-03-06 23:58:30
甲子(갑자),戊申(무신),88,갓생 커플,듬직한 소나무 갑자(A)와 단단한 바위 무신(B)의 만남! 갑자의 부드러운 리더십을 무신이 힙하게 서포트해 주는 구조예요. 수(水)와 금(金)의 기운이 서로를 밀어주고 당겨주니 같이 있으면 텐션이 수직 상승! 서로의 부족한 바이브를 채워주며 성공을 향해 달려가는 시너지 미친 갓생 소울메이트 각입니다.,"서로의 커리어를 응원하며 성장하는 쿨한 바이브. 대화가 잘 통하는 지적인 데이트를 즐기며, 가끔은 깊은 속마음까지 공유하는 찐사랑 모먼트가 가득해요.",둘 다 자기 주관이 뚜렷한 편! 가끔은 고집부리기보다 상대방의 스웨그를 먼저 인정해 주세요. 유연한 소통 한 스푼만 더하면 세상 무적의 케미 완성!,"전시회 관람, 조용한 와인바, 독서 모임",2026-03-06 23:59:14
甲子(갑자),癸丑(계축),95,스며드는 케미,"푸른 나무 갑자(A)와 촉촉한 단비 계축(B)의 만남! 계수가 갑자를 끊임없이 서포트하고, 지지의 자축합이 시너지를 폭발시키는 찰떡궁합이에요. 서로의 세계관에 자연스럽게 스며드는 느낌이라 같이 있으면 정서적 안정감이 미쳤다 소리 절로 나옴! 서로가 서로에게 행운의 부적이 되어주는 소울메이트 각입니다.",차분하면서도 몽글몽글한 힐링 바이브. 굳이 말하지 않아도 서로의 기분을 찰떡같이 알아채는 텔레파시 데이트가 일상이에요.,가끔은 서로 너무 편해서 속마음을 숨길 수도! 사소한 서운함도 귀엽게 공유해주면 우리 사이 텐션은 평생 고공행진 가능해요.,"LP 바, 심야 영화, 호캉스",2026-03-07 00:00:08
甲子(갑자),戊午(무오),82,다이내믹 텐션,"시원한 생명력의 갑자(A)와 뜨거운 열정의 무오(B)가 만난 역대급 자극 케미! 서로 정반대의 MBTI처럼 다른 매력에 확 끌리는 스타일이에요. 물과 불의 만남이라 텐션이 극과 극을 달리지만, 그만큼 서로의 세계관을 200% 확장해주는 성장형 커플! 서로의 결핍을 채워주는 파워풀한 에너지가 아주 힙해요.",냉탕과 온탕을 오가는 짜릿한 밀당 천재 바이브! 조용히 힐링하다가도 갑자기 텐션 터지는 핫플 투어로 분위기 전환하는 반전 매력 데이트가 일상이에요.,서로의 속도가 다를 땐 '그럴 수 있지' 마인드셋 장착! 서로의 다름을 리스펙트해준다면 세상 어디에도 없는 유니크한 찐사랑 완성입니다.,"페스티벌, 루프탑 바, 스포츠 경기 관람",2026-03-07 00:00:50
甲子(갑자),癸亥(계해),92,워터풀 힐링,"쭉 뻗은 소나무 갑자(A)에게 끝없는 수분을 공급하는 계해(B)의 만남! 두 사람 모두 수(水) 기운이 낭낭해서 감수성 텐션이 세계관 최강자급이에요. 서로의 마음을 찰떡같이 알아채는 공감 능력이 시너지를 내니, 같이만 있어도 마음이 편안해지는 소울메이트 각! 서로를 무한 신뢰하며 성장하는 촉촉한 케미가 미쳤습니다.",새벽 감성 터지는 깊은 대화와 정서적 교감이 메인! 화려한 핫플보다는 우리만의 아늑한 아지트에서 꽁냥거리는 릴랙스 바이브가 찐이에요.,둘 다 생각이 깊어 고민이 많아질 수 있어요! 가끔은 딥한 생각에서 벗어나 함께 몸을 움직이는 활동으로 에너지를 환기하면 텐션 유지에 굿!,"물멍 카페, 수족관, 넷플릭스 정주행",2026-03-07 00:01:36
乙丑(을축),戊辰(무진),84,단단한 갓생,끈기 있는 초목 을축(A)과 광활한 대지 무진(B)의 만남! 을축의 섬세한 터치와 무진의 든든한 서포트가 만나 안정감이 미쳤다 소리 절로 나와요. 서로의 성장을 자극하는 건강한 에너지 덕분에 같이 있을수록 시너지가 폭발하는 타입! 뿌리 깊은 나무처럼 흔들림 없는 텐션 세계관을 보여주는 갓생 커플 각입니다.,차곡차곡 신뢰를 쌓아가는 빌드업 연애! 화려한 퍼포먼스보다 소소한 일상을 공유하며 서로의 편이 되어주는 듬직하고 쿨한 바이브가 특징이에요.,둘 다 자기만의 리듬이 확실한 편! 가끔은 서로의 고집을 유연하게 받아주는 텐션 조절이 필요해요. 솔직한 대화 한 스푼이면 찐사랑 유지 가능!,"식물원 카페, 브런치 투어, 원데이 클래스",2026-03-07 00:02:30
乙丑(을축),癸酉(계유),96,착붙 자석 케미,"끈기 만렙 을축(A)과 센스 만점 계유(B)의 만남! 유축합으로 묶여버린 텐션이 거의 자석급이에요. 계유의 촉촉한 기운이 을축을 생해주니 시너지가 미쳤다 소리 절로 나옴! 서로의 마음을 찰떡같이 알아채는 감각적인 소울메이트 각이라, 한 번 빠지면 헤어 나올 수 없는 찐사랑 세계관을 형성하는 중이에요.",세련되고 감각적인 무드! 힙한 감성 카페나 갤러리를 돌며 서로의 취향을 공유하는 고퀄리티 데이트 바이브를 자랑해요.,가끔은 서로 너무 섬세해서 살짝 예민해질 수도! 그럴 땐 '오히려 좋아' 마인드로 솔직하게 웃어넘기면 케미 폭발 유지 가능!,"편집숍 쇼핑, 와인바, 전시회 투어",2026-03-07 00:03:09
乙丑(을축),戊寅(무인),81,밀당 성장 케미,섬세한 들꽃 을축(A)과 듬직한 산 무인(B)의 만남! 을축이 무인의 넓은 품을 파고들며 서로의 세계관을 넓혀주는 중이에요. 목(木)과 토(土)의 에너지가 서로를 건강하게 자극하니 시너지가 미쳤다 소리 절로 나옴! 서로 다른 텐션 덕분에 지루할 틈 없는 소울메이트 각이라 같이 있을수록 갓생 시너지 폭발하는 성장형 커플입니다.,무심한 듯 다정한 무인의 리드와 을축의 섬세한 배려가 섞인 힙한 바이브! 서로의 속도차를 즐기는 밀당 천재들의 세련된 연애 스타일이에요.,각자의 개성이 강해 가끔 텐션 충돌이 생길 수 있음! 그럴 땐 '오히려 좋아' 마인드로 상대의 스타일을 인정해주면 찐사랑 모드 무한 유지 가능!,"한강 피크닉, 베이커리 카페, 도심 야경 산책",2026-03-07 00:03:54
乙丑(을축),癸未(계미),78,성장형 커플,끈기 있는 을축(A)과 감성 장인 계미(B)의 만남! 서로 다른 토(土) 에너지가 충돌하며 새로운 스파크를 일으키는 텐션 세계관이에요. 계미의 촉촉한 비가 을축의 대지를 적셔주니 같이 있을수록 시너지 미쳤다 소리 절로 나옴! 정반대 매력에 끌리는 자극적인 궁합이라 서로의 다름을 리스펙트할 때 찐사랑 모먼트가 폭발하는 성장형 케미입니다.,은근한 밀당이 오가는 텐션 있는 분위기! 차분한 을축과 섬세한 계미가 만나 서로의 감정을 깊게 파고드는 소울메이트 바이브를 자랑해요.,서로의 고집이 맞붙을 땐 '오히려 좋아' 마인드 셋이 필수! 유연한 대화 한 스푼만 더하면 우리 사이 텐션은 평생 무적권 유지 가능해요.,"프라이빗 영화관, 심야 드라이브, 감성 캠핑",2026-03-07 00:04:36
乙丑(을축),戊子(무자),88,안정형 갓벽 케미,"섬세한 초록 감성 을축과 듬직한 대지 바이브 무자가 만난 갓벽 조합! 무자의 넓은 품 안에서 을축이 예쁘게 피어나는 형국이라 정서적 안정감이 미쳤어요. 서로가 서로의 부족한 부분을 퍼즐처럼 채워주는 상호보완적 텐션이라, 시간이 갈수록 신뢰가 떡상하는 소울메이트 각입니다. 은근히 서로에게 스며드는 시너지가 장난 아니네요.",차분하면서도 몽글몽글한 으른 연애 스타일! 화려한 파티보다는 우리만의 아지트에서 도란도란 대화 나누는 걸 선호해요. 서로의 커리어를 응원하며 함께 성장하는 '갓생 커플' 바이브가 뿜뿜!,둘 다 속마음을 꾹꾹 누르는 편이라 가끔은 쿨하게 '감정 오픈런'이 필요해요. 서운한 게 있다면 바로바로 공유해서 소통 지수를 높여보세요. 솔직함 한 스푼이면 텐션 유지 쌉가능!,"LP 바 투어, 프라이빗 전시회, 야간 산책",2026-03-07 00:05:28
乙丑(을축),癸巳(계사),92,촉촉한 힐링 케미,"여린 풀잎 을축과 단비 같은 계사가 만난 역대급 촉촉 조합! 계사가 을축의 뿌리를 적셔주고, 사화(巳)가 따뜻한 햇살까지 비춰주니 이건 뭐 '연애 생태계'의 완성형이죠. 서로가 서로에게 쉼표가 되어주는 힐링 텐션이 미쳤어요. 함께 있으면 세상의 풍파도 다 막아줄 것 같은 소울메이트 각입니다.",감성 브이로그 재질! 조용한 무드의 카페에서 서로 사진 찍어주고 깊은 대화를 나누는 따스한 바이브예요. 은근히 챙겨주는 세심한 배려가 포인트!,둘 다 생각이 많아지면 '동굴 진입' 할 수도! 그럴 땐 맛있는 디저트로 당 충전하며 대화 폼을 올려보세요. 표현만 더 자주 하면 찐사랑 폼 미쳤다!,"재즈 바, 식물원 카페, 호캉스",2026-03-07 00:06:27
乙丑(을축),戊戌(무술),82,갓생 성장 커플,"단단한 대지 무술과 그 위를 파고드는 끈기의 을축이 만난 빌드업 케미! 서로 자존심은 좀 있지만, 한 번 신뢰 쌓이면 절대 안 깨지는 묵직한 텐션이 미쳤어요. 을축의 섬세함이 무술의 듬직함을 만나 안정감이 폭발하는 구조라, 서로의 성장을 자극하는 건강한 시너지가 장난 아닙니다.",서로의 목표를 응원하는 쿨한 파트너 바이브! 같이 공부하거나 운동하면서 에너지를 채우는 생산적인 데이트가 찰떡이에요.,둘 다 고집이 은근 있어서 '기싸움 챌린지'가 될 수도! 먼저 '미안해'라고 말하는 유연함만 장착하면 관계의 폼이 미친 듯이 올라갈 거예요.,"러닝 크루, 클라이밍, 서점 투어",2026-03-07 00:07:16
乙丑(을축),癸卯(계묘),95,몽글 감성 케미,촉촉한 단비 계묘가 끈기 있는 을축의 정원에 내리는 격! 서로 말이 없어도 눈빛만으로 소통 가능한 감성 세계관이 미쳤어요. 을축의 성실함에 계묘의 센스가 더해지니 시너지 폭발! 서로의 결을 가장 잘 이해하는 부드러운 에너지 조합이라 한 번 빠지면 헤어 나오기 힘든 찐사랑 각입니다.,감성 필터 장착한 에어드랍 바이브! 소품샵 구경하거나 예쁜 카페에서 서로의 인생샷 찍어주며 꽁냥거리는 힐링 데이트가 주특기예요.,가끔 둘 다 '파워 F' 모드가 되면 고민의 늪에 빠질 수 있어요. 그럴 땐 팩트 체크 한 스푼으로 서로의 멘탈을 토닥여주면 텐션 유지 쌉가능!,"플라워 원데이 클래스, 필름 카메라 산책",2026-03-07 00:08:01
乙丑(을축),戊申(무신),84,갓생 시너지 커플,끈기 만렙 을축과 활동량 미친 무신의 만남! 을축이 무신이라는 거대한 바위산을 예쁘게 장식해주는 형국이라 시각적 합부터 이미 갓벽해요. 을축의 섬세한 터치와 무신의 화끈한 실행력이 합쳐지면 못 할 게 없는 무적 세계관 탄생! 서로의 폼을 최고조로 끌어올려 주는 윈윈 케미가 장난 아닙니다.,에너지 넘치는 액티비티 바이브! 무신이 리드하면 을축이 꼼꼼하게 계획을 완성하는 환상의 티키타카가 특징이에요. 함께 맛집 도장 깨기 할 때 텐션 폭발!,둘 다 자기 주관이 뚜렷해서 가끔 '팩폭' 배틀이 열릴 수 있어요. 그럴 땐 귀여운 이모지로 부드럽게 대화 폼을 바꿔주는 센스만 챙기면 찐사랑 모드 유지 쌉가능!,"팝업 스토어 투어, 한강 자전거 데이트",2026-03-07 00:08:42
乙丑(을축),癸丑(계축),89,정서적 소울메이트,겨울 땅 위를 뚫고 나오는 을축과 그 위로 내리는 촉촉한 단비 계축의 만남! 같은 '축(丑)' 에너지를 공유해서 말하지 않아도 통하는 텔레파시 텐션이 미쳤어요. 서로의 고충을 누구보다 잘 알아주는 찐 이해심 덕분에 정서적 유대감이 폭발하는 구조! 시간이 지날수록 서로에게 깊게 스며드는 '슬로우 본드' 시너지가 장난 아닙니다.,세상 차분하고 포근한 힐링 바이브! 시끌벅적한 곳보다 우리만 아는 심야 식당이나 잔잔한 음악이 흐르는 공간에서 감성을 충전하는 스타일이에요.,둘 다 신중한 편이라 가끔 분위기가 너무 진지해질 수 있어요! '먼저 웃기기 챌린지'나 장난스러운 드립으로 연애 텐션을 가볍게 끌어올려 주면 갓벽!,"심야 영화 정주행, 전시회 관람",2026-03-07 00:09:36
乙丑(을축),戊午(무오),78,단짠 성장형 커플,차분하고 끈기 있는 을축과 핫한 불꽃 에너지를 가진 무오의 만남! 얼어붙은 땅을 녹여주는 무오의 열정 덕분에 을축의 잠재력이 폭발하는 시너지가 미쳤어요. 서로 다른 온도 차가 오히려 강한 끌림을 만드는 '자극제 케미'라 한 번 빠지면 헤어 나오기 힘든 마성의 텐션 세계관을 자랑합니다.,무오의 파워풀한 리드와 을축의 세심한 서포트가 만난 갓벽 밸런스! 핫플 데이트와 정적인 휴식이 공존하는 다이내믹한 연애 바이브예요.,가끔 무오의 불도저 텐션에 을축이 깜짝 놀랄 수 있어요! 서로의 '에너지 속도'를 존중하며 천천히 스며드는 '기다림 챌린지'만 성공하면 찐사랑 각!,"루프탑 바, 락 볼링장, 캠핑 불멍",2026-03-07 00:10:19
乙丑(을축),癸亥(계해),94,딥러브 힐링 케미,"겨울 땅을 뚫고 나온 을축과 깊고 넓은 바다 같은 계해가 만난 정서적 끝판왕 조합! 계해의 마르지 않는 에너지가 을축의 성장을 무한 서포트해주니 시너지가 미쳤어요. 서로의 결핍을 채워주는 '상호구원 서사' 급 텐션이라, 시간이 지날수록 서로에게 더 깊게 스며드는 찐사랑 세계관이 펼쳐집니다.",세상 차분하고 촉촉한 무드! 서로의 플레이리스트를 공유하거나 비 오는 날 창가에서 같이 멍 때리는 것만으로도 행복 지수 떡상하는 감성 연애 바이브예요.,가끔 둘 다 감성 과부하가 걸려 속마음을 숨길 수 있어요. '오늘의 기분'을 솔직하게 에어드랍 하는 연습만 하면 관계의 폼이 무한대로 상승할 거예요!,"아쿠아리움, LP 바 투어, 비 오는 날 드라이브",2026-03-07 00:11:01
丙寅(병인),戊辰(무진),88,갓생 시너지 커플,뜨거운 태양 병화(丙)와 든든한 대지 무토(戊)의 만남! 병화의 에너지가 무토를 환하게 비춰주니 서로 보면 광대 승천하는 조합이에요. 나무(寅)와 흙(辰)의 생명력까지 더해져 같이 있으면 아이디어가 샘솟고 세상 힙한 건 다 하고 싶은 텐션 폭발 예감! 서로의 존재 자체가 자존감 뿜뿜하게 만드는 시너지 미친 세계관이에요.,둘이 만나면 텐션이 기본 200%! 계획 없이 만나도 핫플만 쏙쏙 찾아가는 힙스터 바이브예요. 서로 리액션 맛집이라 대화가 끊이지 않는 찐사랑 모먼트가 가득해요.,둘 다 에너지가 넘쳐서 가끔은 '자기주장 타임'이 올 수 있어요. 그럴 땐 서로의 속도에 맞춰주는 센스 한 스푼만 더하면 완벽한 소울메이트 각! 배려도 힙하게 하는 게 포인트예요.,"루프탑 바, 페스티벌 직관, 셀프 사진관",2026-03-07 00:11:53
丙寅(병인),癸酉(계유),82,무지개맛 텐션,태양(丙)과 비(癸)가 만났으니 이건 완전 '무지개 각' 소울메이트! 화끈한 직진형 A와 섬세한 쿨톤 B의 만남은 드라마틱한 텐션 세계관을 만들어요. 서로 다른 매력에 스며드는 속도가 장난 아님! 불꽃 튀는 열정과 시원한 감성이 만나서 매일이 새로운 폼 미친 시너지 커플이에요.,"낮에는 갓생 사는 커플, 밤에는 딥토크 장인들! A가 리드하면 B가 센스 있게 서포트하는 환상의 티키타카가 특징이에요. 같이 있으면 왠지 주인공 된 기분!",가끔 소나기가 내려도 금방 맑아지는 날씨 같은 커플이에요. 서로의 온도 차를 즐기는 여유만 장착하면 찐사랑 모먼트 무한 업데이트 가능! 다름이 곧 매력 포인트예요.,"미술관 투어, 야경 드라이브, LP바",2026-03-07 00:12:46
丙寅(병인),戊寅(무인),92,파워 갓생 커플,"태양(丙)과 대지(戊)가 만났는데, 둘 다 숲(寅)을 품고 있는 형상! 이건 거의 '성공 서사' 찍는 시너지 미친 조합이에요. 서로를 보면 열정이 불타오르고, 같이 있으면 세상 못 할 일이 없는 무적의 텐션 세계관이죠. 서로의 야망을 리스펙하며 함께 성장하는 모습이 딱 요즘 핫한 워너비 커플 그 자체!","만나면 아이디어가 쏟아지는 브레인스토밍 바이브! 핫플 탐방은 기본이고, 서로의 성장을 응원하는 갓생 데이트가 일상이에요. 쿨하고 당당한 연애의 정석!",둘 다 에너지가 넘쳐서 가끔은 '휴식 모드'가 필요할지도! 서로의 속도감을 체크하며 가끔은 멍 때리는 시간을 가지면 찐사랑 유효기간 무한대 연장 가능해요.,"팝업 스토어, 테니스 데이트, 와인바",2026-03-07 00:13:32
